{"id":"GLOSS-HETEROZYGOSITY","term":"Heterozygosity","definition":"Presence of different alleles at a genetic locus within an individual, contributing to segregation and variation among sexually produced offspring.","domain":"genetics","status":"draft","version":"1.0.0","references":["REF-GENETICS-001"],"relatedEncyclopedia":["ENC-GENETICS-BREEDING-010"]}
